{
  "$schema": "./fill-attestation.schema.json",
  "description": "EIP-712 FillAttestation(bytes32 orderId,address payee) vectors for AttestedFillVerifier (ESCROW-RFC §9.4), with proof = abi.encode(address payee, bytes signature). signer_private_key values are PUBLIC Hardhat/Anvil TEST keys: never fund or register them.",
  "domain": {
    "name": "RiddlerFillAttestation",
    "version": "1"
  },
  "typehash": "0x8fb120a49b8d8498dcf8f2893d205e3a012ea58c31b515bb1cffee5c12cff976",
  "vectors": [
    {
      "name": "baseline-base",
      "chainId": "8453",
      "verifyingContract": "0x5555555555555555555555555555555555555555",
      "orderId": "0xe9f0165c274aefaeb888d41292fe8311c318c8b7ef7eaef285df9996e0f35f16",
      "payee": "0x70997970C51812dc3A010C7d01b50e0d17dc79C8",
      "expected_struct_hash": "0x2dea85e96a23a09331e4a1eb80f319d4fdb77c5551223ba730c12f656b469cca",
      "expected_domain_separator": "0x2395d70aeb8baed8da6a2ff73e15e894153cc5b09082d42e0707fe40d54a5ac0",
      "expected_digest": "0x7fd24925a26540d5b93a789460a2be266e357df1782a6dd4753b1d8c92ad0de7",
      "signer_private_key": "0xac0974bec39a17e36ba4a6b4d238ff944bacb478cbed5efcae784d7bf4f2ff80",
      "signer_address": "0xf39Fd6e51aad88F6F4ce6aB8827279cffFb92266",
      "expected_signature": "0xadc109fdb2574bc71e10a78b3fbd14975f716a863ff87b900ada039c349e5f557ff430cf214ffb73107a59816ab4ed182370084cf85a0c6f5c4ec79a0538a4701b",
      "expected_proof": "0x00000000000000000000000070997970c51812dc3a010c7d01b50e0d17dc79c800000000000000000000000000000000000000000000000000000000000000400000000000000000000000000000000000000000000000000000000000000041adc109fdb2574bc71e10a78b3fbd14975f716a863ff87b900ada039c349e5f557ff430cf214ffb73107a59816ab4ed182370084cf85a0c6f5c4ec79a0538a4701b00000000000000000000000000000000000000000000000000000000000000"
    },
    {
      "name": "second-signer",
      "chainId": "8453",
      "verifyingContract": "0x5555555555555555555555555555555555555555",
      "orderId": "0xe9f0165c274aefaeb888d41292fe8311c318c8b7ef7eaef285df9996e0f35f16",
      "payee": "0x70997970C51812dc3A010C7d01b50e0d17dc79C8",
      "expected_struct_hash": "0x2dea85e96a23a09331e4a1eb80f319d4fdb77c5551223ba730c12f656b469cca",
      "expected_domain_separator": "0x2395d70aeb8baed8da6a2ff73e15e894153cc5b09082d42e0707fe40d54a5ac0",
      "expected_digest": "0x7fd24925a26540d5b93a789460a2be266e357df1782a6dd4753b1d8c92ad0de7",
      "signer_private_key": "0x59c6995e998f97a5a0044966f0945389dc9e86dae88c7a8412f4603b6b78690d",
      "signer_address": "0x70997970C51812dc3A010C7d01b50e0d17dc79C8",
      "expected_signature": "0xa7e00ae0fbfc5b5264f3450425e7973e2966c855e4313a191745e8137c27218538f61664d1d5e91c08b1a0801683277a4c324700b8ae9bbc32d3433f4d7a90f11c",
      "expected_proof": "0x00000000000000000000000070997970c51812dc3a010c7d01b50e0d17dc79c800000000000000000000000000000000000000000000000000000000000000400000000000000000000000000000000000000000000000000000000000000041a7e00ae0fbfc5b5264f3450425e7973e2966c855e4313a191745e8137c27218538f61664d1d5e91c08b1a0801683277a4c324700b8ae9bbc32d3433f4d7a90f11c00000000000000000000000000000000000000000000000000000000000000"
    },
    {
      "name": "other-chain-and-verifier",
      "chainId": "1",
      "verifyingContract": "0x9A676e781A523b5d0C0e43731313A708CB607508",
      "orderId": "0xe9f0165c274aefaeb888d41292fe8311c318c8b7ef7eaef285df9996e0f35f16",
      "payee": "0x70997970C51812dc3A010C7d01b50e0d17dc79C8",
      "expected_struct_hash": "0x2dea85e96a23a09331e4a1eb80f319d4fdb77c5551223ba730c12f656b469cca",
      "expected_domain_separator": "0xc2a098075831a1c83245dd86cbfee162ae25c6740dc6781ab635c8c30f589648",
      "expected_digest": "0xbdbed82185e4dce1f309ef1f7a040682693983a72d1ed5aec184670834d8f4ee",
      "signer_private_key": "0xac0974bec39a17e36ba4a6b4d238ff944bacb478cbed5efcae784d7bf4f2ff80",
      "signer_address": "0xf39Fd6e51aad88F6F4ce6aB8827279cffFb92266",
      "expected_signature": "0x4f2666c61265d34ae45d7ff9c779187421b9fbf186dddbd60f9936e3e7cc4f531e387223ae3e669df820eff698cf14d5177d1c0bd3c75aec70523d4bcaa3532a1b",
      "expected_proof": "0x00000000000000000000000070997970c51812dc3a010c7d01b50e0d17dc79c8000000000000000000000000000000000000000000000000000000000000004000000000000000000000000000000000000000000000000000000000000000414f2666c61265d34ae45d7ff9c779187421b9fbf186dddbd60f9936e3e7cc4f531e387223ae3e669df820eff698cf14d5177d1c0bd3c75aec70523d4bcaa3532a1b00000000000000000000000000000000000000000000000000000000000000"
    },
    {
      "name": "one-order-id-zero-payee",
      "chainId": "8453",
      "verifyingContract": "0x5555555555555555555555555555555555555555",
      "orderId": "0x0000000000000000000000000000000000000000000000000000000000000001",
      "payee": "0x0000000000000000000000000000000000000000",
      "expected_struct_hash": "0xf93127a4496932858d0c406a4fa3187a58776680f180b9282fac9987dc5ed18b",
      "expected_domain_separator": "0x2395d70aeb8baed8da6a2ff73e15e894153cc5b09082d42e0707fe40d54a5ac0",
      "expected_digest": "0x311555685196289fd5c89ed3927a4a91ff00aa1784c184093cafc4409c1ad533",
      "signer_private_key": "0xac0974bec39a17e36ba4a6b4d238ff944bacb478cbed5efcae784d7bf4f2ff80",
      "signer_address": "0xf39Fd6e51aad88F6F4ce6aB8827279cffFb92266",
      "expected_signature": "0xeb24d656032a829f5d40c2b0163cdad56e136cd228bcf9651a1140be5b63301e6ceb7dd33d78dce097d1fd6d0f1c76d8307675926bee5275ab2b8d937260f4ee1b",
      "expected_proof": "0x000000000000000000000000000000000000000000000000000000000000000000000000000000000000000000000000000000000000000000000000000000400000000000000000000000000000000000000000000000000000000000000041eb24d656032a829f5d40c2b0163cdad56e136cd228bcf9651a1140be5b63301e6ceb7dd33d78dce097d1fd6d0f1c76d8307675926bee5275ab2b8d937260f4ee1b00000000000000000000000000000000000000000000000000000000000000"
    },
    {
      "name": "max-uint256-order-id-max-payee",
      "chainId": "42161",
      "verifyingContract": "0x5555555555555555555555555555555555555555",
      "orderId": "0xffffffffffffffffffffffffffffffffffffffffffffffffffffffffffffffff",
      "payee": "0xFFfFfFffFFfffFFfFFfFFFFFffFFFffffFfFFFfF",
      "expected_struct_hash": "0xdcf38b95df506a9fae3225cf8ed91c40227325011f2961d3c99bf8d52f226de1",
      "expected_domain_separator": "0x368e7f321d7bee78328342b7095645baf24272b19a658eb33844bcec162fd70e",
      "expected_digest": "0xaa4e9e9cc374fc76b2e1701aebbe78249e836a01d56b67133d102efda667fe5f",
      "signer_private_key": "0x59c6995e998f97a5a0044966f0945389dc9e86dae88c7a8412f4603b6b78690d",
      "signer_address": "0x70997970C51812dc3A010C7d01b50e0d17dc79C8",
      "expected_signature": "0x3c93289149e930c9f4c7d35063780bc15061e720f2a813fab300ee9e237ebcd9513d4a3498d9ca301dde88353f8bfc7b62af1ec4049452f2aa2775c4ba7668321c",
      "expected_proof": "0x000000000000000000000000ffffffffffffffffffffffffffffffffffffffff000000000000000000000000000000000000000000000000000000000000004000000000000000000000000000000000000000000000000000000000000000413c93289149e930c9f4c7d35063780bc15061e720f2a813fab300ee9e237ebcd9513d4a3498d9ca301dde88353f8bfc7b62af1ec4049452f2aa2775c4ba7668321c00000000000000000000000000000000000000000000000000000000000000"
    }
  ]
}
